video_id,title,published_at,views,likes,comments,channel_name,,keyword
gNCVn4XBU8k,QUAL COMPENSA MAIS? CMF Buds 2 Plus vs Realme Buds Air 7 Pro,2025-10-20T13:08:35Z,694,44,16,Tech News,,none
1zNpajKzuPQ,A EXCELÊNCIA É GARANTIDA! CMF Buds 2 Plus vs CMF Buds Pro 2,2025-10-16T12:15:00Z,705,59,15,Tech News,,none
H00Bflr6ebc,CONEXÃO DUPLA PARA GAMERS! Headphone Gamer QCY Heroad V200,2025-10-13T11:38:16Z,400,28,6,Tech News,,none
oakGL215Cjg,Microfone de Lapela Saramonic Blink500 B2+ [iOS e Android],2025-10-09T16:31:20Z,171,13,4,Tech News,,none
0XHY8EoMB-M,DIFÍCIL SUPERAR Este Custo Benefício! Headphone Haylou S40,2025-10-06T13:37:27Z,563,59,26,Tech News,,none
PAPtTlsA9w0,Linux Q&A - Hauke und Jean beantworten Eure Fragen! - Live,2025-11-18T21:10:39Z,2438,141,3,Linux Guides,,none
3DfF8R5jXdM,Affinity auf Linux: Schritt für Schritt Anleitung,2025-11-14T14:00:06Z,9629,427,50,Linux Guides,,none
I2vfN8WJH9M,Tux-Tage 2025 Samstag (Track A),2025-11-08T17:57:44Z,3901,161,1,Linux Guides,,none
QCCJz4o0Uog,Tux-Tage 2025 (Samstag) (Track B),2025-11-08T16:38:42Z,2553,73,1,Linux Guides,,none
iWESD9jDShU,"CachyOS löst die Probleme, die ich mit Debian auf dem Desktop habe. Ein Erfahrungsbericht",2025-11-08T15:01:18Z,23716,715,222,Linux Guides,,none
K3Wz3pi1RfM,Tux-Tage 2025 (Freitag),2025-11-07T21:35:21Z,4643,194,5,Linux Guides,,none
CZeKgpk63hU,Linux Q&A - Hauke und Jean beantworten Eure Fragen! - Live,2025-11-04T20:49:21Z,3698,177,10,Linux Guides,,none
Xgi0DMeHdys,Tux Tage 2025 - am 7. und am 8. November - Trailer,2025-11-01T05:34:41Z,1968,71,2,Linux Guides,,none
7OF8P-eRjo8,Sicherheit für Linux: Braucht man VPN und Virenschutz? - Bye Windows 10! Teil 5/5,2025-10-31T12:21:55Z,11728,622,127,Linux Guides,,none
2Il7BASEBjg,Endlich volle Kompatibilität? Die Wahrheit über WinBoat,2025-10-25T13:10:40Z,38940,1196,146,Linux Guides,,none
9Zw3ay3_tCQ,Database Deadlocks Easily Explained,2025-11-15T12:21:13Z,2294,136,14,Software Developer Diaries,,none
vnnqLJdxgQY,The Database Secret Behind Modern AI Apps (Vector Databases),2025-11-07T16:17:27Z,1116,68,0,Software Developer Diaries,,none
udXXPSOq-DU,So here is what's new in Node.js,2025-11-01T16:48:00Z,2154,125,3,Software Developer Diaries,,none
4e3lK7OhuOg,What do Multi-Agent Architectures look like?,2025-10-17T16:25:27Z,1493,61,7,Software Developer Diaries,,none
wXg_aON4oj8,Event Sourcing: Genius or Just Over-Engineering?,2025-10-10T16:57:49Z,1792,87,10,Software Developer Diaries,,none
x6FU7BE8seU,That's how I would design Uber in 2025,2025-09-06T05:21:08Z,2278,128,11,Software Developer Diaries,,none
6LOONFhwPqE,How to become a Software Architect in the AI Era?,2025-08-30T08:39:10Z,2413,119,17,Software Developer Diaries,,none
Nk5qtstKypA,One Line Bug That Wiped Shopify's Database,2025-08-25T16:26:11Z,3462,125,28,Software Developer Diaries,,none
2QaqDwRl0_8,Latest JavaScript Features You Might Have Missed,2025-08-24T05:38:47Z,2152,146,13,Software Developer Diaries,,none
ALO_GQFkbiw,The Power of RabbitMQ Quorum Queues,2025-08-13T20:44:11Z,2066,79,9,Software Developer Diaries,,none
U7mQBDZkE5I,"Metasploit Full Course | Learn Ethical Hacking, Exploits, Payloads & Post-Exploitation",2025-11-12T15:00:54Z,4410,263,34,whitesec cyber security ,,none
X2zfIqNqVU0,"Netcat for Ethical Hackers - Shells, Encryption, Persistence & Data Exfiltration",2025-10-21T11:04:23Z,3448,204,27,whitesec cyber security ,,none
3J367Hd0ZZg,SQLMap Masterclass - 7 Hour Practical Ethical Hacking & PenTesting Course for Beginners to Advanced,2025-08-25T15:48:35Z,8652,387,77,whitesec cyber security ,,none
TtLY56jTT78,From Zero to Web Hacker in 5 Hours - Practical Attacks & Hands-On Demo,2025-08-01T12:28:17Z,23920,824,91,whitesec cyber security ,,none
xsZZ_11yYAM,Penetration Testing Course In 10 hours | Penetration Testing Course For Beginners | Metasploit,2025-05-31T18:40:46Z,22636,749,97,whitesec cyber security ,,none
yw5j1kNRrMI,AI for Ethical Hackers - Complete ChatGPT & AI Cybersecurity Masterclass,2025-05-02T14:52:33Z,19422,819,68,whitesec cyber security ,,none
8z7wGVOv-SU,"Android Penetration Testing for Beginners - Build, Customize & Deploy MSFvenom Payloads",2025-03-06T12:42:15Z,17896,541,88,whitesec cyber security ,,none
A9G-r550cPI,"Nessus Vulnerability Scanning Masterclass (2 Hours) - Install, Scan & Report Like a Pro",2025-02-24T05:46:20Z,18209,479,32,whitesec cyber security ,,none
T_zF1YOVo34,Linux for Pentesters - Complete Kali Linux Course (5 Hours Beginner to Pro),2025-02-08T16:49:15Z,19218,717,57,whitesec cyber security ,,none
_ze9YC5nmHw,owasp scanner full course in 1 hour | zap scanner | zap vulnerability scanner,2025-01-07T19:05:03Z,16606,441,71,whitesec cyber security ,,none
XmKPqzyNShU,8 Python Skills You Need Learning Anything Advanced,2025-11-20T09:15:17Z,20,0,0,Python Coding (CLCODING),,none
OBfMMMpzorI,Mastering Pandas: A Data Science Essential | Part 2,2025-11-20T01:52:26Z,355,21,2,Python Coding (CLCODING),,none
4AnxPbsd9EY,Python Coding Challenge ID 01061125,2025-11-19T14:15:05Z,600,16,0,Python Coding (CLCODING),,none
n1O2AIUHWUs,Word Frequency Example Using wordfreq in Python,2025-11-19T08:06:51Z,509,12,0,Python Coding (CLCODING),,none
G6yLqKywQOo,Retrieving Metadata for HGNC in Python,2025-11-18T07:11:22Z,1133,14,0,Python Coding (CLCODING),,none
u9EDjMbW07U,10 Python Codes for Data Structure  List Tuples & Dictionaries,2025-11-18T01:01:18Z,152,9,0,Python Coding (CLCODING),,none
rx77NsCHLl4,Python Coding Challenge ID 01051125,2025-11-17T12:53:08Z,510,12,1,Python Coding (CLCODING),,none
HFdzYXnjdrg,Python Coding Challenge (ID-01041125),2025-11-17T03:02:55Z,754,16,0,Python Coding (CLCODING),,none
FoQ-UAAUP3w,Mastering Pandas: A Data Science Essential,2025-11-17T02:06:49Z,741,38,0,Python Coding (CLCODING),,none
QUkEoymPKN0,7 Python Function Power Moves For Real Projects,2025-11-16T09:15:33Z,211,15,0,Python Coding (CLCODING),,none
k3l4M4xuTm4,Mini-Projeto 10 - Conclusão,2025-11-18T02:39:11Z,74,0,0,Data Science Academy,,none
InH4UbEfLA4,Mini-Projeto 10 - Cereja do Bolo - Demonstração de Deploy da App com Streamlit na Nuvem AWS -  2/2,2025-11-18T02:38:29Z,87,1,0,Data Science Academy,,none
XWhVeEEN8H8,Mini-Projeto 10 - Cereja do Bolo - Demonstração de Deploy da App com Streamlit na Nuvem AWS -  1/2,2025-11-18T02:37:53Z,44,1,0,Data Science Academy,,none
iI7ZZ4n4hco,Mini-Projeto 10 - Deploy e Uso da App com Streamlit,2025-11-18T02:37:09Z,45,0,0,Data Science Academy,,none
XwQdRYVv52I,Mini-Projeto 10 - Função Principal - Ponto de Entrada da Execução no Streamlit,2025-11-18T02:36:26Z,32,0,0,Data Science Academy,,none
jH8aolTYBIc,Mini-Projeto 10 - Função Principal - Expansor Para Informações Complementares na App do Streamlit,2025-11-18T02:35:47Z,30,1,0,Data Science Academy,,none
ULXiKh26Nvc,Mini-Projeto 10 - Função Principal - Tab 2 Para Visualização de Dados e Exportação,2025-11-18T02:35:05Z,25,0,0,Data Science Academy,,none
#NAME?,Mini-Projeto 10 - Função Principal - Tab 1 Para Visualizações Interativas,2025-11-18T02:34:28Z,33,0,0,Data Science Academy,,none
x9d3bBa2M8c,Mini-Projeto 10 - Função Principal - Divisão em Tabs e Divisão em Colunas no Streamlit,2025-11-18T02:33:54Z,30,0,0,Data Science Academy,,none
NibKQT_RluQ,Mini-Projeto 10 - Função Principal - Inicialização dos Dados,2025-11-18T02:33:15Z,33,1,0,Data Science Academy,,none
gA-a9u7pYGE,Cisco Wireless | Dynamic Interface Group | How to scale Wireless Network in Hindi,2025-11-01T10:22:06Z,302,11,1,Cisco Network Learning,,none
AwQ-mTZIDDg,Wi-Fi Association and Athentication Explained in Hindi,2025-10-30T10:41:36Z,411,14,1,Cisco Network Learning,,none
pLuSDPXq_Ik,Wireless | Troubleshooting  AP Not Joing WLC,2025-10-13T07:56:11Z,934,32,2,Cisco Network Learning,,none
wbhsNgDgusE,Status Codes in F5 BIG IP,2025-08-24T11:01:27Z,570,15,1,Cisco Network Learning,,none
Hx2kgLdqHJ8,F5 Load-Balancer - Traffic flow demo,2025-08-03T11:51:35Z,989,28,2,Cisco Network Learning,,none
xFItcOP_d2A,Native VLan | By Rajan Chandora,2025-07-06T12:11:56Z,1791,55,5,Cisco Network Learning,,none
dKdG-RF0W-Q,How Pvst and CST Work Together,2025-06-20T13:45:05Z,561,18,4,Cisco Network Learning,,none
tcSCclAkc4s,STP Port Priority | Why Increment of 16 in STP Port Priority,2025-06-19T13:45:12Z,545,14,4,Cisco Network Learning,,none
8bm3JJ_atps,STP Bridge ID | why 4096 increment in priority,2025-06-18T13:45:03Z,575,16,2,Cisco Network Learning,,none
TU86A5WSu0U,Use of VLan 4095 in Hindi,2025-06-08T12:15:44Z,1132,37,2,Cisco Network Learning,,none
dvawshh3Bgw,Ranking Top Data Science Projects (S-C Tier),2025-11-17T15:01:20Z,4563,266,53,Sheryians AI School,,none
rIpsuxi0vCQ,Sheryians AI Live QnA session,2025-11-11T04:46:21Z,1830,90,9,Sheryians AI School,,none
BS4hOeOvwNo,How to crack your first Internship/Job ?,2025-11-07T04:44:46Z,4007,192,7,Sheryians AI School,,none
i-ODhfs_e-M,Lets Talk about Job opportunities and Market,2025-11-05T16:19:16Z,3357,140,6,Sheryians AI School,,none
Zadt7w5zUns,Sheryians AI Live Baat cheet session,2025-11-05T04:12:26Z,1720,73,9,Sheryians AI School,,none
ES0YrZfroEo,Sheryians AI Live QnA session,2025-11-04T04:40:40Z,2064,84,21,Sheryians AI School,,none
Qjks2g0OADo,Data Science and analytics with Generative AI launch,2025-11-01T16:55:09Z,10157,459,41,Sheryians AI School,,none
4bbLyjjOeHc,Data Science + Analytics + Gen AI | Launch your AI Career now,2025-11-01T15:18:25Z,13282,602,88,Sheryians AI School,,none
TIkEPkRI0p4,Sheryians AI Live QnA session,2025-10-29T04:40:54Z,2392,148,8,Sheryians AI School,,none
DX5uF1zPnws,The ML workflow that you must know.,2025-10-27T14:00:19Z,6769,425,80,Sheryians AI School,,none
oBwHO3UD03o,Testing case generation with ChatGPT,2025-11-02T15:01:34Z,45,0,0,Software Engineering,,none
#NAME?,Code review and Optimisation with ChatGPT,2025-11-01T15:00:00Z,31,1,0,Software Engineering,,none
zAoQpuTzU-c,The Ai Bubble and Jobs Future - Some facts & figures by Hammad Maqbool,2025-10-31T17:39:33Z,60,7,5,Software Engineering,,none
gpM31Nd10P8,Learn fast with ChatGPT,2025-10-31T15:01:20Z,24,1,0,Software Engineering,,none
Ri395pNKtfc,Debugging with ChatGPT - Guide for programmer,2025-10-30T15:01:02Z,20,0,0,Software Engineering,,none
ZoT7crzHU4U,Writing a perfect prompt for ChatGPT being a Programmer - Guide,2025-10-29T15:01:18Z,38,2,2,Software Engineering,,none
3eehGyTLwQM,Intro to ChatGPT and how it is useful for Programmers,2025-10-28T15:00:10Z,45,1,0,Software Engineering,,none
SUlp1A1NoQ0,Closing words on typescript series,2025-10-27T15:05:00Z,39,2,0,Software Engineering,,none
F1He2MGge84,33 Concept of Namespace and Project management in typeScript,2025-10-27T15:00:33Z,19,0,2,Software Engineering,,none
qiiBo-5eCqw,32 using modules and classes in HTML file in TS,2025-10-26T15:01:34Z,230,6,0,Software Engineering,,none
fOcoLKHeOTI,How Computer Works ? Complete Beginners Guide.,2024-04-25T12:18:45Z,29955,475,16,Learn Computer Science,,none
Lwg2pH-x1yg,Functions Of Computer | Beginners Introduction To Functions Of Computer,2023-10-22T16:43:53Z,13662,194,8,Learn Computer Science,,none
DuZiuryMnGs,Introduction To Database Design,2023-04-19T10:54:52Z,6862,99,7,Learn Computer Science,,none
dpnYzKATBKA,"Introduction To Operating System | OS Functions , Features And Types",2023-02-20T12:25:20Z,60038,809,30,Learn Computer Science,,none
duhGa6SJeq8,What Is RAM ?  |  Computer Random Access Memory - RAM Explained,2023-02-12T12:27:03Z,24818,298,10,Learn Computer Science,,none
UeKXCwQGL3s,What Is Computer Motherboard ? | Beginners Guide To Motherboard Parts,2022-10-08T06:47:50Z,43285,660,23,Learn Computer Science,,none
8_itvuz5Dc4,What Is Computer Hardware ? | Beginners Guide To Computer Hardware.,2022-10-03T08:00:25Z,371365,5635,126,Learn Computer Science,,none
H_aoaQYgKT8,What Is Arithmetic Logic Unit ? | ALU  In Computer Architecture Explained.,2022-05-31T13:59:43Z,116750,1494,54,Learn Computer Science,,none
#NAME?,What Is Control Unit ? | Control Unit Functions And Working Explained,2022-04-30T02:27:59Z,45887,662,23,Learn Computer Science,,none
6fgbLOL7bis,What Is Instruction Set Architecture ? | Computer Organization And Architecture COA,2022-04-13T13:36:15Z,83297,1175,24,Learn Computer Science,,none
MuHNTg-KL7o,[LIVE] - Ask Me Anything (AMA) & Live Hacking - 11/19/25,2025-11-20T10:36:09Z,513,35,1,Tyler Ramsbey - Hack Smarter,,none
SwQ4Z0_SlBk,Hacking Linux: Privilege Escalation - (Talisman - Part 3),2025-11-19T13:01:04Z,235,16,3,Tyler Ramsbey - Hack Smarter,,none
i9_DlJ8ylpc,[LIVE] - Live Hacking & Ask Me Anything (AMA) - 11/18/25,2025-11-19T06:33:32Z,576,42,2,Tyler Ramsbey - Hack Smarter,,none
NVZEXi7dros,[LIVE] - Cybersecurity Careers - AMA (Ask Me Anything),2025-11-18T09:10:20Z,578,41,4,Tyler Ramsbey - Hack Smarter,,none
LZAJsarIX_8,Being an introvert is a GOOD thing. (maybe...),2025-11-17T15:27:18Z,342,32,8,Tyler Ramsbey - Hack Smarter,,none
Z_SHHoBlv3o,Full preview of my web app pentesting course!,2025-11-16T20:48:07Z,792,64,24,Tyler Ramsbey - Hack Smarter,,none
M61inxssRe0,[LIVE] - Friday Hacking & AMA (11/14/25),2025-11-15T07:44:30Z,605,40,1,Tyler Ramsbey - Hack Smarter,,none
7Foj0nmJj7s,"I took a $60,000 paycut (on purpose). #entrepreneur #hacking #cybersecurity #startup",2025-11-15T03:50:42Z,1744,91,5,Tyler Ramsbey - Hack Smarter,,none
E3Fj0DgwIuo,Hacking Linux: Exploitation - (Talisman - Part 2),2025-11-14T14:22:11Z,518,41,5,Tyler Ramsbey - Hack Smarter,,none
iFLuUYPKNFk,[LIVE] - Thursday Hacking & AMA (11/13/25),2025-11-14T05:26:24Z,728,53,1,Tyler Ramsbey - Hack Smarter,,none
nVCJBBNapJo,Web Scraping with Python & Scrapy for Beginners: Build a Real-World Web Crawler Project,2025-11-13T14:01:26Z,1545,93,12,Code with Josh,,none
zbXZQlCWYzo,AI Project: Build a Resume Reader in Python with OpenAI (Can AI Read Your Resume?),2025-11-06T14:01:42Z,819,48,14,Code with Josh,,none
jqAQ4oQGUH0,Flet + Python: Build a Cross-Platform App (Desktop | Mobile | Web) in 30 Minutes,2025-10-30T14:01:20Z,34996,1071,81,Code with Josh,,none
gxRctjz1LC0,Engineering Workflow: How I Plan a Python Project Before Writing Code,2025-10-23T14:01:00Z,3013,141,10,Code with Josh,,none
jphcg52uJaw,I Gave 4 AI App Builders the Same Prompt — The Results Shocked Me,2025-10-16T14:01:25Z,452,30,12,Code with Josh,,none
crgQOez8d4k,Learn Python in 2 Hours — Complete Course for Beginners [2026],2025-10-09T14:01:04Z,8068,135,22,Code with Josh,,none
0XjO177iEbk,10 Nooby Python Mistakes Beginners Make — Fix Them Fast (Code Examples),2025-10-02T14:00:01Z,901,74,4,Code with Josh,,none
ngXbyui-weA,"Python Asynchronous Programming Tutorial: Asyncio, async & await Explained",2025-09-25T14:01:21Z,1491,117,10,Code with Josh,,none
2Ry78DUeONw,Web Scraping in Python — Reddit Scraper with BeautifulSoup [No API],2025-09-18T14:00:06Z,2324,108,21,Code with Josh,,none
0nOHK8FtXmM,Face Mask Detection Tutorial — TensorFlow 2 (CNN),2025-09-11T14:00:01Z,1178,68,18,Code with Josh,,none
IbTwNPV5574,QD-OLED Gen 3 Burn-In After 1.5 Years – Alienware AW3225QF Update,2025-11-15T13:00:28Z,9341,432,92,Type-C Tech Reviews,,none
KZEO2atVcTY,Top 5 Prime Day Gaming Monitor Deals 2025,2025-07-08T14:04:04Z,14636,188,41,Type-C Tech Reviews,,none
7IOps8ZqG0s,Gigabyte Aorus CO49DQ Super-Ultrawide QD-OLED Gaming Monitor Unboxing & Review (ish),2025-01-10T13:00:09Z,10879,161,54,Type-C Tech Reviews,,none
YpHvQeesfLY,Gigabyte M27U Advanced Gaming Monitor Review,2025-01-04T13:00:45Z,12257,200,64,Type-C Tech Reviews,,none
_H-SrZRwG4A,Gigabyte M27U Advanced 4K 160Hz Gaming Monitor Unboxing,2025-01-01T13:00:39Z,7196,145,20,Type-C Tech Reviews,,none
QXB8J86MYnY,"Asus ROG Strix 27"" XG27UCG (4K 160Hz or 1080p 320Hz) Gaming Monitor Review",2024-12-30T13:00:33Z,36132,597,94,Type-C Tech Reviews,,none
oTMHCXePNCE,"Asus ROG Strix 27"" XG27UCG (4K 160Hz or 1080p 320Hz) Gaming Monitor Unboxing",2024-12-27T13:01:04Z,16102,264,29,Type-C Tech Reviews,,none
CEPja6KAyE4,LG 24GS50F-B Ultragear Gaming Monitor Review,2024-12-26T13:00:11Z,70713,910,138,Type-C Tech Reviews,,none
Vv7lCpUKGYc,Dell G16 vs. Acer Nitro V16 | Gaming Laptop Comparison,2024-12-24T13:00:40Z,16276,261,51,Type-C Tech Reviews,,none
FoVgYgHvpVI,LG 24GS50F-B Ultragear Gaming Monitor Unboxing,2024-12-21T13:00:22Z,23151,284,77,Type-C Tech Reviews,,none
RyJ_4lIccsQ,"AWS Lambda Environment Variables Explained | Encryption, Versions & KMS Integration",2025-11-19T19:30:05Z,14,1,0,CloudWolf AWS,,none
TxMttLnnado,CodeBuild automatically compiles your code fully managed and serverless.#aws #ai #cloud #wolf #fyp,2025-11-19T12:52:19Z,124,0,0,CloudWolf AWS,,none
vW2CKmY8y-U,CodePipeline runs your entire CI/CD workflow each time you push new code #aws #ai #cloud #wolf #fyp,2025-11-18T12:55:53Z,127,2,0,CloudWolf AWS,,none
RBsn88Lc6bY,"AWS Lambda Event Source Mapping Explained | Kinesis, SQS, DynamoDB & Kafka Integration",2025-11-17T19:45:01Z,44,1,0,CloudWolf AWS,,none
Np7SH1NOM8I,CloudTrail Lake is a centralized & queryable audit log repository of user actions #aws #cloud #wolf,2025-11-17T15:25:33Z,181,1,0,CloudWolf AWS,,none
lQOl3HnmCqg,QuickSight creates AI-powered visual dashboard directly from tge data #aws #amazon #cloud #wolf #fyp,2025-11-16T14:03:42Z,382,2,2,CloudWolf AWS,,none
GSBR4G4pVAE,"AWS Lambda with S3 Event Notifications Explained | Triggers, Filters & Best Practices",2025-11-15T20:56:43Z,36,0,0,CloudWolf AWS,,none
ZyUrScbalfE,"Athena runs SQL queries directly on data in S3. No servers, no setup. #aws #amazon #cloud #wolf #fyp",2025-11-14T13:02:15Z,457,2,0,CloudWolf AWS,,none
W1OCmN9qJKY,Redshift = AWS’s fully managed data warehouse for analytics across datasets #aws #cloud #wolf #fypシ,2025-11-13T17:34:56Z,383,3,0,CloudWolf AWS,,none
6inppxZu_9I,Glue automates data integration across sources to prepare data for analytics #aws #cloud #wolf #fyp,2025-11-12T14:11:39Z,297,5,0,CloudWolf AWS,,none
hHYjqfI19r0,LEO: A Live Coding Assistant for Teachers,2025-11-14T14:23:45Z,1156,95,21,Radu Mariescu-Istodor,,none
zhOmPuuraJg,How I Edit My Coding Tutorials,2025-11-07T14:02:02Z,798,76,34,Radu Mariescu-Istodor,,none
EkqcBE-tqbY,Blindfolded Live Coding the Bezold Camera Effect in JS (Inspired by @Vsauce),2025-11-06T02:21:02Z,662,61,1,Radu Mariescu-Istodor,,none
nuuHeNgZDEY,Blindfolded Live Coding @Vsauce's Emordnilap Machine in JS (we also talk about the channel ending),2025-11-01T18:25:22Z,2391,169,42,Radu Mariescu-Istodor,,none
_u48171Sb5I,JavaScript Mystery Project Tutorial,2025-10-17T13:01:10Z,1101,81,26,Radu Mariescu-Istodor,,none
L81rbAi78mw,BRIO Train Track Builder in JavaScript,2025-10-10T13:00:41Z,1058,51,12,Radu Mariescu-Istodor,,none
YtbsmaYSd0M,BRIO Train Track Piece Generator in JavaScript,2025-10-03T13:01:12Z,1197,77,32,Radu Mariescu-Istodor,,none
6eNfnMPwI9s,Water Pipes Illusion with JavaScript and HTML Canvas,2025-09-26T13:00:19Z,2079,138,36,Radu Mariescu-Istodor,,none
k-_ZXdoa8-U,Why It Took Me 2 Years to Make This Course,2025-09-19T13:01:38Z,2055,140,24,Radu Mariescu-Istodor,,none
wH6gZB7m22k,Computational Problem Solving #SoME4,2025-08-22T13:51:42Z,5557,352,93,Radu Mariescu-Istodor,,none
Dd0MxqcdmSI,Learn Destructuring! It can improve your code.,2025-01-17T20:12:44Z,507,47,8,"All Things JavaScript, LLC",,none
kj0aSrQwjlA,Why are JavaScript Strings Iterables?,2024-12-12T19:28:00Z,431,57,5,"All Things JavaScript, LLC",,none
4o8q0qVE-3c,Are JavaScript Primitives Actually Objects?,2024-12-06T07:00:06Z,330,40,19,"All Things JavaScript, LLC",,none
SXAQL_YHtpM,Understanding Short Circuit Evaluation Using &&,2023-07-31T21:27:40Z,1329,77,6,"All Things JavaScript, LLC",,none
J9S1zE6zjnQ,Remove Duplicates from JavaScript Array,2023-05-04T22:23:59Z,5877,158,9,"All Things JavaScript, LLC",,none
gW3KcIfNorE,JavaScript Fundamentals: Merging Objects with Object.assign(),2023-04-10T21:41:06Z,1620,77,11,"All Things JavaScript, LLC",,none
JR4pAvxXjes,Insert Data into an Array Every so Many Elements,2023-02-21T23:29:38Z,1444,59,20,"All Things JavaScript, LLC",,none
dlWSmr8hWgI,JavaScript Fundamentals: Primitives Versus Primitive Objects,2023-01-31T18:08:25Z,1121,66,11,"All Things JavaScript, LLC",,none
TYBd1sk5t7I,JavaScript Problem: Flattening an Array of Sub-arrays,2023-01-20T17:28:38Z,1688,70,15,"All Things JavaScript, LLC",,none
FV75RupVoQE,JavaScript Problem: Explaining Eloquent JavaScript's Matrix Class,2022-12-14T17:55:51Z,1437,53,7,"All Things JavaScript, LLC",,none
_IVpaN_Cl7E,"Online Education System using Google Classroom, Youtube Broadcast and Google Meet APIs",2020-04-16T08:30:13Z,6069,66,13,WB Web Development Solutions,,none
FQLr4zncn1I,Full stack web development Course | 132. Swag Shop: Finishing Our Full Stack React App,2019-04-12T16:28:16Z,47439,407,50,WB Web Development Solutions,,none
kFdkv3AufjM,Full stack web development Course | 131. Swag Shop: Observing Notifications in React,2019-04-11T16:27:48Z,10187,62,0,WB Web Development Solutions,,none
ZB6exFzYpH0,Full stack web development Course | 130. Swag Shop: Posting Notifications to React Components,2019-04-10T16:27:45Z,7090,41,2,WB Web Development Solutions,,none
22crMW2HcqA,Full stack web development Course | 129. Swag Shop: Creating a Notification Service,2019-04-09T16:28:45Z,5618,43,1,WB Web Development Solutions,,none
jO7PiCbVAXA,Full stack web development Course | 128. Swag Shop: Building a Singleton Data Service,2019-04-08T16:28:15Z,4426,37,5,WB Web Development Solutions,,none
My85lR_0DKM,Full stack web development Course | 127. Swag Shop: Creating a WishList Component,2019-04-07T16:27:49Z,4274,38,3,WB Web Development Solutions,,none
QMuB9lc-xW8,Full stack web development Course | 126.  Swag Shop: Working With State in React,2019-04-03T08:27:48Z,3847,30,5,WB Web Development Solutions,,none
MgUA72yZ7lU,Full stack web development Course | 125. Swag Shop: Props in React,2019-04-02T08:27:49Z,3683,29,1,WB Web Development Solutions,,none
WPG6CKvkLps,Full stack web development Course | 124. Swag Shop: Components in React - Website Product,2019-04-01T08:28:17Z,3790,27,1,WB Web Development Solutions,,none
4W_8do0eHu0,Time Series Analysis on a GPU with Pandas and cuDF (Ep. 07),2025-05-22T10:00:13Z,689,22,0,Python Tutorials for Digital Humanities,,none
qdZkPduLxhw,Accelerating Pandas with NVIDIA's cuDF: Basic Statistical Analysis and Data Cleaning (Ep. 06),2025-05-16T15:01:33Z,232,16,1,Python Tutorials for Digital Humanities,,none
WfE3nYqGA8U,Speed up Cleaning Data with Pandas and your GPU! (CuDF Episode 5),2025-05-09T10:01:03Z,547,23,1,Python Tutorials for Digital Humanities,,none
IjRAwAeTq2g,Mastering Data Manipulation with CUDA Accelerated Pandas with cuDF - Hands on Guide (Ep. 04),2025-05-02T11:00:27Z,376,20,0,Python Tutorials for Digital Humanities,,none
8X_IaCNpo7E,Exploring Big Data with cuDF Pandas: A Step-by-Step Guide Using GPU Acceleration (Ep. 03),2025-03-11T15:34:23Z,685,24,1,Python Tutorials for Digital Humanities,,none
l8mZWH87vU8,Accelerate Your Pandas Data Analysis with RAPIDS cuDF: Using Pandas 500x Faster! (Episode 02),2025-02-21T10:00:51Z,1921,47,6,Python Tutorials for Digital Humanities,,none
7zxUnXHhdfc,How to Think about Big Data in Python (cuDF Ep. 01),2025-02-03T13:00:14Z,468,23,4,Python Tutorials for Digital Humanities,,none
quJtzVxoMtE,Best Way to OCR a PDF in Python - spaCy Layout,2025-01-14T11:51:29Z,13942,385,33,Python Tutorials for Digital Humanities,,none
sD7LHzgbsWk,Four Ways to Create Sentences in Python with spaCy,2024-08-13T20:47:19Z,2298,74,1,Python Tutorials for Digital Humanities,,none
s86jz9qVeWA,Best Way to Build Network Analysis App in Python with Streamlit and st-link-analysis - Easy Tutorial,2024-07-15T10:00:49Z,6206,196,6,Python Tutorials for Digital Humanities,,none
foafYcyN1wc,CASETiFY iPhone 17 Pro Cases First Looks: Protective * Durable * High Quality * Super Customizable,2025-09-09T19:00:42Z,10947,127,69,The Tech Reviewer,,none
ie0fuDdE-NQ,*NEW* AirX for iPhone 16 Pro: RHINOSHIELD's Toughest Case!,2025-08-15T21:00:48Z,3087,65,40,The Tech Reviewer,,none
cOeNl7RUGkw,"RHINOSHIELD SolidSuit, JellyTint & Clear for iPhone 16 Pro: Now With Camera Control Button Update!",2025-02-22T13:00:52Z,9306,141,51,The Tech Reviewer,,none
QhiCF8tAo_0,Anker Prime 100W 3 Port Charger & Anker 15W Qi2 3-in-1 Foldable Charger: Fast Multi Device Charging!,2024-12-20T22:00:18Z,1265,28,10,The Tech Reviewer,,none
5AIAC26WSIc,BodyGuardz Paradigm Pro for iPhone 16 Pro: 18 Ft Drop Protection * Vents to Keep your iPhone Cooler!,2024-12-20T20:00:03Z,1538,32,12,The Tech Reviewer,,none
KPS-enK_0ek,Mujjo Full Leather MagSafe Wallet: Beautiful Full Grain Leather * Strong Magnets * 3 Card Capacity!,2024-12-13T21:00:14Z,902,23,11,The Tech Reviewer,,none
hXOuPK_bH8c,"CASETiFY Festive Faves: Great Gift Ideas for your iPhone, iPad, AirPods, and More!",2024-12-06T21:00:27Z,1091,24,14,The Tech Reviewer,,none
xna9wpPND-o,Mous Limitless 6.0 & Super Thin 2.0 for iPhone 16 Pro: Check out the Lineup!,2024-11-29T15:03:11Z,2651,52,37,The Tech Reviewer,,none
7dWQzKfFx8w,FLOLAB ONETIME NanoArmour for iPhone 16 Pro: Great Installer * Case Compatible * Comes in a 2 Pack!,2024-11-17T13:00:08Z,2185,46,22,The Tech Reviewer,,none
Lz-JVudQezM,UAG Plasma XTE for iPhone 16 Pro: 20 ft Drop Protection * MagSafe * Built in Stand!,2024-11-02T02:30:56Z,3631,43,32,The Tech Reviewer,,none
XvCMQz5kMFY,[33/90] Check the full tutorial on my youtube channel 📱✨ #shorts #coding #uidesign,2025-11-05T17:11:24Z,2596,57,2,Android Knowledge,,none
ahZHmHXbTio,[32/90] answering the most common asked questions on shorts 💬✅ #androiddevelopment,2025-11-04T17:41:32Z,512,12,0,Android Knowledge,,none
6R0AZuDfULo,[30/90] 5 free courses certificates ✅✨ #coding #freecourses #certificate,2025-10-30T17:35:44Z,1138,38,3,Android Knowledge,,none
ynsonL_9jSA,Create an Instagram Home Screen UI using Jetpack Compose | Android Studio Tutorial,2025-10-29T14:31:00Z,706,42,8,Android Knowledge,,none
A-BdJ1TuQaI,"[26/90] Things experience teaches, not tutorials. #shorts #coding",2025-10-26T16:33:06Z,1383,35,6,Android Knowledge,,none
hFvBEQ4XLNI,[24/90] 😂💻 #shorts #funny,2025-10-24T16:13:28Z,1746,30,4,Android Knowledge,,none
